,Date,Headline,News,Sentiment
21,"6/24/2024, 11:33 AMUpdated 06/24/2024, 11:45 AM","Music labels sue AI companies Suno, Udio for US copyright infringement","By Blake Brittain(Reuters) -Major record labels  Sony  (NYSE:SONY) Music, Universal Music Group (AS:UMG) and Warner Records sued artificial intelligence companies Suno and Udio on Monday, accusing them of committing mass copyright infringement by using the labels' recordings to train music-generating AI systems.The companies copied music without permission to teach their systems to create music that will ""directly compete with, cheapen, and ultimately drown out"" human artists' work, according to federal lawsuits filed against Udio in New York and Suno in Massachusetts.Representatives for Suno and Udio did not immediately respond to requests for comment on the complaints. The complaints said Suno and Udio users have been able to recreate elements of songs including The Temptations' ""My Girl,"" Mariah Carey's ""All I Want for Christmas Is You"" and James Brown's ""I Got You (I Feel Good),"" and could generate vocals that are ""indistinguishable"" from musicians such as Michael Jackson, Bruce Springsteen and ABBA. The labels asked the courts to award statutory damages of up to $150,000 per song the defendants allegedly copied. The lawsuits are the first to target music-generating AI following several cases brought by authors, news outlets and others over the alleged misuse of their work to train text-based AI models powering chatbots like OpenAI's ChatGPT. AI companies have argued that their systems make fair use of copyrighted material. Cambridge, Massachusetts-based Suno and New York-based Udio have raised millions in funding this year for their AI systems, which create music in response to user text prompts. The labels' complaints said the companies have been ""deliberately evasive"" about the material they used to train their technology, and that revealing it would ""admit willful copyright infringement on an almost unimaginable scale.""""Unlicensed services like Suno and Udio that claim it's 'fair' to copy an artist's life's work and exploit it for their own profit without consent or pay set back the promise of genuinely innovative AI for us all,"" Mitch Glazier, CEO of the Recording Industry Association of America, said in a statement.",Neg
22,"6/24/2024, 11:34 AMUpdated 06/24/2024, 11:35 AM","Chevron flags second-quarter production impact at TCO, Gulf of Mexico assets","(Reuters) -  Chevron  (NYSE:CVX) said on Monday it expects upstream turnarounds and downtime to impact 65,000 barrels of oil equivalent per day in production in the second quarter mostly at Tengizchevroil (TCO) in Kazakhstan and several Gulf of Mexico assets.The U.S. oil major said it expects downstream turnarounds to impact earnings by $300 million to $400 million mainly due to maintenance at the El Segundo and Richmond refineries in California.",Neg
23,"6/24/2024, 11:06 AMUpdated 06/24/2024, 11:09 AM","Goldman initiates coverage on IT Services sector, sees compelling risk/reward in IBM, GLOB","Analysts at Goldman Sachs assessed the Americas IT Services sector in a note Monday, initiating coverage on eight companies and highlighting ""compelling risk/reward"" in    IBM    (NYSE:IBM) and Globant (GLOB). Their note acknowledges both cyclical headwinds and long-term potential.Analysts see the sector experiencing a cyclical downturn due to macro pressures and a shift in spending towards AI-focused capital expenditures. However, they believe concerns about Generative AI as a threat to IT Services are overblown. While some technical hurdles exist, AI is ultimately seen as beneficial, particularly for Business Process Services.The crux of the note lies in the differentiation between cyclical and secular risks. Analysts argue the market is conflating these factors, creating an opportunity for select companies.The ""Goldman Sachs IT Services Investing Framework"" evaluates companies' growth potential, returns, capital allocation, and stock positioning. Buy ratings target companies where market appreciation for sustainable growth or potential cyclical recovery is lacking.Based on this framework, Goldman Sachs issues Buy ratings for IBM with a $200 price target (PT) and Globant with a $200 PT. Conversely, Thoughtworks and TaskUs receive Sell ratings with PTs of $2.50 and $12 respectively, reflecting a less favorable risk/reward profile. The remaining companies - Accenture, Cognizant, EPAM Systems, and Softchoice - receive Neutral ratings.",Neutral
24,"6/24/2024, 10:11 AMUpdated 06/24/2024, 10:45 AM",US Supreme Court gives pharma companies a chance to thwart terrorism-funding lawsuit,"By Mike ScarcellaWASHINGTON (Reuters) -The U.S. Supreme Court gave a boost on Monday to a challenge by 21 pharmaceutical and medical equipment companies led by AstraZeneca (NASDAQ:AZN) to a lawsuit accusing them of illegally helping to fund terrorism that killed or injured hundreds of American troops and civilians in Iraq.The justices threw out a lower court's ruling that revived a lawsuit brought by the military personnel and civilians who said they were harmed between 2005 and 2011 in the Iraq war. The justices asked the lower court to reconsider the case.Hundreds of American service members and civilians, and their families, sued the defendant companies, part of five corporate families: AstraZeneca,  Pfizer  (NYSE:PFE), GE Healthcare USA, Johnson & Johnson (NYSE:JNJ) and F. Hoffmann-La Roche.The plaintiffs accused major U.S. and European pharmaceutical and device makers of providing corrupt payments to the Hezbollah-sponsored militia group Jaysh al-Mahdi in order to obtain medical supply contracts from Iraq's health ministry. The plaintiffs alleged the militia group controlled the health ministry.The lawsuit, brought in 2017 in federal court in Washington, seeks unspecified damages under the Anti-Terrorism Act, a federal law that lets Americans pursue claims related to ""an act of international terrorism.""A federal trial judge in 2020 dismissed the lawsuit, but the U.S. Court of Appeals for the District of Columbia Circuit in 2022 overturned that decision and let the case move ahead.The companies have denied wrongdoing and said they ""are not responsible in any way for the tragic events that were caused and carried out by Iraqi militia groups.""In a joint statement, the pharmaceutical and device companies on Monday said they welcomed the Supreme Court's ruling. They said the lawsuit should now be dismissed based on a Supreme Court ruling last year in a case involving the social media platform Twitter, now called X.""The companies continue to vigorously dispute the plaintiffs' allegations in this case and are not responsible in any way for the tragic events that were caused and carried out by Iraqi militia groups,"" the statement added.The companies had said in a filing to the justices that the Supreme Court ruling shielding Twitter from liability under the federal Anti-Terrorism Act should bar the claims in this case. In the Twitter case, the Supreme Court determined that aiding-and-abetting claims under the Anti-Terrorism Act require showing that a defendant ""consciously and culpably"" participated in a terror act to help it succeed.The plaintiffs countered in a filing that those who sued Twitter had sought to hold that company liable for ""mere inaction"" - the alleged failure to exclude a terrorism group from the platform.The pharmaceutical and device makers' ""knowing bribes to terrorists were far more culpable,"" the plaintiffs said.An attorney for the plaintiffs did not immediately respond to a request for comment on Monday.",Neutral
25,"6/24/2024, 10:42 AMUpdated 06/24/2024, 10:44 AM",UBS: S&P 500 earnings growth to rise 11% this year,"UBS strategists expect S&P 500 earnings to rise 11% this year, driven by healthy economic growth and growing investment in artificial intelligence (AI). The investment bank reiterated its optimism toward the market due to solid and broadening profit growth, disinflation, and a Fed pivot to rate cuts. This, coupled with rising AI infrastructure investments, has driven the S&P 500 to new record highs. Despite cooling growth readings, strategists believe the economy is stable, supported by a robust labor market. Low initial jobless claims, 1.2 open jobs per unemployed worker, and rising real wages indicate continued consumer spending strength. Jobs are still being added in construction and manufacturing, key cyclical sectors, UBS highlighted.In addition, while first-quarter inflation was higher than expected, it softened in the second quarter.“We expect this disinflation trend to continue,” the UBS team noted.“Pricing power for corporate America continues to moderate, wage pressures are easing, consumer inflation expectations remain well contained, and the shelter component of the government's inflation data should continue to moderate,” they added.This, in turn, should pave the way for the Fed to begin cutting interest rates later in the year. UBS expects a total of two cuts in 2024, with the first one anticipated in September. “With the Fed now in a position to cut rates in case economic growth falters, this should limit the scope of potential downside risks for stocks,” strategists continued.Meanwhile, Q1 earnings results were better than expected, noted UBS, adding it was particularly impressed by the guidance and the fact that earnings per share (EPS) growth is beginning to broaden beyond the Magnificent 7 group. AI trends were particularly strong, fueled by an increase in capital spending by the mega-cap companies. “We think the underlying demand will remain robust as the tech companies jockey for the pole position in the emerging AI ecosystem, and companies across the economy look to deploy AI tools into their business processes.”As a result, UBS now sees S&P 500 EPS increasing by 11% in 2024 to $250 and by 6% in 2025 to $265, “which could prove to be conservative,” it noted. Overall, strategists believe the environment remains favorable for U.S. equities, recommending a full allocation to the asset class. Their S&P 500 targets are 5,500 for year-end 2024 and 5,600 for June 2025.",Pos
26,"6/23/2024, 02:15 PMUpdated 06/24/2024, 10:35 AM",UPS announces sale of Coyote Logistics unit to RXO for $1 billion,"(Reuters) -United Parcel Service, the world's biggest package delivery firm, will sell its Coyote Logistics business unit to RXO for $1.025 billion, the companies said on Sunday. The transaction will be funded with a mix of equity and debt, including a $300 million equity investment from MFN Partners and a $250 million equity investment from Orbis Investments, North Carolina-based RXO said in a statement. ""The decision to sell our Coyote Logistics business allows an even greater focus on our core business,"" UPS Chief Executive Officer Carol Tome said.RXO helps shippers and carriers to move freight. UPS bought Coyote Logistics from private equity firm Warburg Pincus for $1.8 billion in 2015 to expand its full-truckload services.",Pos
27,"6/24/2024, 10:33 AMUpdated 06/24/2024, 10:35 AM",'From value to growth stock:' BofA hikes Broadcom price target,"Bank of America analysts raised their price target on Broadcom (NASDAQ:AVGO) shares from $2,000 to $2,150, citing its “transformation to growth from a value stock driven by growing AI and VMWare contributions. Historically, AVGO’s traditional semiconductor and software segments grew at a normalized pace of 5% to 10%. Bank of America now expects growth to double to a compound annual growth rate (CAGR) of 13% from 2024 to 2026, “led by 24% CAGR across AI silicon and VMWare that could soon account for over half of sales.”“In our view, AVGO’s diverse growth drivers, highly regarded management team, and unique track-record of capital appreciation, dividend growth and above mkt. div yield can justify a premium multiple,” analysts said in a note.“Despite being the #8th largest stock in the S&P 500, AVGO’s institutional ownership, per Bank of America’s Strategy team, remains well below market weight,” they added.Broadcom's trailing 43% free cash flow (FCF) is second only to Nvidia (NASDAQ:NVDA) in the semiconductor sector. It also leads the industry with a combination of 15% annual dividend growth and an above-market indicated dividend yield of 1.25%.Bank of America said potential risks to its bullish thesis include any sentiment shifts in the AI theme, as well as customer concentration, rising NVDA competition, and the company’s large $60 billion net debt.",Pos
28,"6/24/2024, 10:27 AM",Markets are underestimating Fed cuts: UBS,"UBS analysts warn that markets might be misjudging the extent of future interest rate cuts by the Federal Reserve.In a note, the bank argues that while the timing of the first cut is debated, the endpoint of the easing cycle holds greater significance for investors.""Since the beginning of the year, investor expectations on Fed cuts have been a major driver of market sentiment,"" the note states. However, UBS emphasizes that ""the destination of rates matters more for the investment outlook, not the beginning of the journey.""The bank highlights equities' resilience despite shifting expectations of Fed action. The S&P 500's strong performance this year, despite a significant reduction in anticipated cuts, underscores the role of solid economic fundamentals.""Whether the first Fed cut happens in September or December likely won't make any material difference,"" UBS argues.UBS focuses on the market-implied neutral policy rate, reflected in the 10-year Treasury yield. They believe the Fed's upcoming Jackson Hole Economic Policy Symposium will likely see increased scrutiny of current policy's restrictiveness.Recent economic data, including consumer confidence, job vacancies, and inflation figures, suggest a softening economy, prompting UBS to believe that ""the weakening in data, which is likely to continue in the coming months, should be sufficient to justify Fed rate cuts.""They expect the Fed to cut rates more than currently anticipated, citing a significant gap between the Fed's projected long-run rate of 2.75% and the market's expectation of around 4%.""Overall, we think markets are underestimating the likely number of Fed cuts over the cycle,"" UBS concludes.",Neutral
29,"6/24/2024, 09:19 AMUpdated 06/24/2024, 10:25 AM",Riot Platforms seeks three board seats at Bitfarms after thwarted takeover bid,"(Reuters) -Bitcoin miner Riot Platforms (NASDAQ:RIOT) is seeking three board seats at rival Bitfarms, a long-sought acquisition target that has rebuffed its $950 million buyout offer and adopted a poison pill to fend off any attempt at a hostile takeover.Riot, the biggest shareholder in Bitfarms with a nearly 15% stake, withdrew the offer on Monday but said it was ""ready to engage"" with the company's reconstituted board about a potential transaction.The two companies have been at loggerheads since Riot's unsolicited offer in April, which Bitfarms said undervalued the company. Toronto-based Bitfarms has since begun reviewing its strategic alternatives. Riot has, however, accused it of lacking solid corporate governance earlier this month, setting the stage for a board battle.Crypto miners are aggressively hunting for growth opportunities, partly to offset the hit to their earnings from Bitcoin's so-called ""halving"" in April.The halving, which occurs roughly every four years to reduce the rate at which new bitcoins are created, cuts miners' rewards by half.Riot has called for a special meeting of Bitfarms' shareholders to vote on its three director nominees - John Delaney, Amy Freedman and Ralph Goehring. Delaney is a government and public affairs expert, while Freedman is a former investment banker who has helped boards with corporate governance matters, Riot said. Goehring is a veteran CFO with expertise in financial, accounting and tax matters, according to the company. All three candidates are independent of both companies and will ""help oversee the strategic alternatives process at Bitfarms,"" Riot added. Shares of Bitfarms and Riot dropped nearly 7% and 2%, respectively. Bitfarms did not immediately respond to a request for comment.",Neutral
30,"6/24/2024, 04:51 AMUpdated 06/24/2024, 10:16 AM",Hyundai Motor's union in South Korea votes to strike,"By Heekyong YangSEOUL (Reuters) -Hyundai Motor's unionised workers in South Korea voted for possible strike action after talks with the company over wage increases and an extension of the retirement age stalled, the automaker's union said on Monday. The union, one of the biggest in the country with more than 43,000 members, said that almost 90% of its members had approved strike action unless the company accepts the union's demands. A strike would mark the first such action in six years related to wage negotiations at the South Korean carmaker and could disrupt production of some popular vehicles at home, which Hyundai has been exporting to offset its sluggish domestic sales. ""We are open to have negotiations with the management if they are willing to change their stance,"" a Hyundai Motor (OTC:HYMTF) union official told Reuters, adding that the union plans to carry out working-level talks with the management. The union and the management had a total of eight rounds of wage negotiations up to mid-June. Hyundai Motor declined to comment. Analysts said it is still too early to tell whether or not the union would actually launch a strike this year, but if a strike takes place it would inevitably impact Hyundai's short-term sales, especially for the popular cars sold in the United States, Hyundai's biggest revenue-generating market. Analysts added that Hyundai Motor's management could use the automaker's new U.S. plant, its largest investment outside South Korea, as bargaining leverage because it could help reduce Hyundai's dependence on domestic production. The union is seeking a minimum basic monthly pay increase of 159,800 won ($115.14) and performance pay equating to 30% of Hyundai's 2023 net profit. It is also demanding an increase in the retirement age to 64 from 60, as South Korea's rising life expectancy and inadequate retirement pension payments prompt demands to be able to work for longer.""Hyundai Motor's union at home has always voted for strike action every year and this year is no different, however, the union might push a bit harder than previous years as the company has been doing well and the pandemic is long gone, so workers would like to push for bigger compensation this time,"" said Chang Moonsu, an analyst at Hyundai Motor Securities.While production disruptions at Hyundai's domestic factories would be inevitable, management would encourage workers not participating in the strike to work overtime to minimize the impact, Chang added. ($1 = 1,387.9200 won)",Neg
31,"6/24/2024, 07:07 AMUpdated 06/24/2024, 09:56 AM","Shein filed for London listing in early June, sources say","By Kane Wu and Julie ZhuHONG KONG (Reuters) -Shein confidentially filed papers with Britain's markets regulator in early June, two sources said, kicking off the process for a potential London listing by the online fast-fashion retailer later in the year. The China-founded company, which was valued at $66 billion in a fundraising round last year, began to explore a listing on the London Stock Exchange early this year, Reuters reported in May, citing sources. Shein's original plan to list in New York came unstuck following opposition from U.S. lawmakers.A spokesperson for Shein and a spokesperson for Britain's markets watchdog, the Financial Conduct Authority (FCA), declined to comment.Both the sources, who have knowledge of the deal, declined to be named as they were not authorised to speak to the media.It is not immediately clear when Shein, known for its $5 tops and $10 dresses, plans to launch the initial public offering (IPO). Shein has updated China's securities regulator officially about its change of listing venue, said the sources. The company, however, has yet to receive a nod from the China Securities Regulatory Commission (CSRC), one of them said.The CSRC did not immediately respond to a Reuters request for comment.The FCA would typically take up to a couple of months to vet and decide on clearance.With a green light from both the FCA and CSRC, Shein would be in a position to publicly file an intention to float on the London stock exchange.That would kick-off a typically four-week process of book building and price guidance before admission to trading.If Shein does decide to press the button on a UK listing it will likely have to deal with a new government.Opinion polls say Keir Starmer's Labour Party is on course to easily win Britain's July 4 election and end the 14 year rule of the Conservatives.Labour has met with Shein and indicated its support for its potential London listing, which would be a boost for a UK market that has seen several high profile companies choose other venues.However, some senior lawmakers have questioned Shein's suitability and called for greater scrutiny of its labour practices, supply chain and use of an import tax exemption.Shein has said it is investing in strengthening governance and compliance across its supply chain and that the duty-free treatment of low-value parcels is not critical to its success.Shein's London filing marks a shift from its long-running U.S. IPO plan, which has run into obstacles at home and abroad, Reuters has reported.The group confidentially filed for an IPO with the U.S. Securities and Exchange Commission in November and approached the CSRC to seek Beijing's nod in the same month, sources have said.The CSRC earlier this year informed Shein that the regulator would not recommend a U.S. IPO due to the company's supply chain issues, Reuters has reported.Last week, Italian luxury sneaker maker Golden Goose postponed its IPO on the Milan bourse because of market volatility arising from political uncertainty, illustrating the challenging environment for new listings in Europe.",Pos
32,"6/23/2024, 07:49 PMUpdated 06/24/2024, 09:35 AM",US stocks mixed; tight trading ranges ahead of inflation cues,"Investing.com -- U.S. stocks traded in a mixed fashion Monday, remaining near record highs as investors looked to key inflation data this week for more cues on interest rates.At 06:00 ET (10:00 GMT), Dow Jones Industrial Average rose 75 points, or 0.2%, S&P 500 traded largely flat, while NASDAQ Composite fell 24 points, or 0.1%. The main indices remain close to all-time highs, boosted by the enthusiasm surrounding artificial intelligence. The broad-based S&P 500 index is up almost 15% so far this year, while the tech-heavy Nasdaq Composite has gained almost 18%. The blue-chip Dow Jones Industrial Average has lagged, by contrast, gaining just under 4% in the first half of the year. These healthy gains open up the possibility of profit-taking, with as much as 52% of respondents to a Bloomberg survey saying they believe the S&P 500 is overpriced.Moreover, 49% of respondents said they see the next S&P 500 10% correction to start sometimes in 2024. Similarly, 55% said they expect to keep the same S&P 500 exposure over the next month.Markets are focused chiefly this week on PCE inflation data, which is due Friday. The reading is the Fed’s preferred inflation gauge, and is likely to tie into the central bank’s stance on interest rate cuts.The PCE reading is expected to show inflation cooled slightly in May, but remained well above the Fed’s 2% annual target. Expectations of an eventual lowering in interest rates had driven Wall Street indexes to record highs through June, even as the Fed signaled that sticky inflation and a strong economy kept chances of such a scenario slim. Some key quarterly earning prints were also on tap this week.Delivery and logistics firm FedEx (NYSE:FDX), whose earnings are also viewed as a bellwether for global economic activity, is set to report its earnings for the quarter ended May on Tuesday. Memory chip maker Micron Technology (NASDAQ:MU) is set to report its quarterly earnings on Wednesday, after forecasting a major demand spike from the fast growing artificial intelligence industry. Sports apparel maker  Nike  (NYSE:NKE) and pharmaceutical retailer Walgreens Boots Alliance (NASDAQ:WBA) are set to report earnings on Thursday.Crude prices stabilized Monday after the previous week’s positive tone on signs of stronger oil products demand in the U.S., world's largest consumer.By 09:35 ET, the U.S. crude futures (WTI) traded 0.1% lower at $80.66 a barrel, while the Brent contract edged higher to $84.35 per barrel.Both benchmarks gained around 3% last week after data from the Energy Information Administration showed a hefty drawdown in U.S. crude stockpiles, pointing to healthy demand as the summer driving season kicks into top gear.The market also received support from worsening geopolitical conditions as the risk of an all-out war between Israel and Hezbollah, as an extension of the conflict with Hamas, rises, playing into expectations of supply disruptions in the Middle East. Continued clashes between Russia and Ukraine, with Kyiv targeting major Russian refineries, also spurred concerns over supply disruptions. (Ambar Warrick contributed to this article.)",Neutral
