,Date,Headline,News,Sentiment
49,"6/24/2024, 07:41 AMUpdated 06/24/2024, 07:43 AM",Trump Media stock jumps as company expects $69.4mn in proceeds from warrants exercise,"Shares in Trump Media & Technology Group (DJT) jumped in premarket trading on Monday after the company said it expects to receive more than $69.4 million from the recent cash exercise of warrants. The stock was up 7% at the time of writing. The parent company of former President Donald Trump’s Truth Social platform announced Friday that these cash exercises were enabled after the SEC approved the company’s Form S-1 registration statement.If all warrants under this statement are exercised for cash, the company could receive up to $247 million. Moreover, $40 million of restricted cash will become unrestricted due to the effective registration statement.",Pos
50,"6/24/2024, 05:15 AMUpdated 06/24/2024, 07:40 AM","Italy's Eni aims to finalise Enilive stake sale by year-end, CEO says","ROME (Reuters) -Italian energy group Eni expects to complete the sale of a minority stake in its biofuel unit Enilive by the end of 2024, Chief Executive Claudio Descalzi said on Monday. ""The (sale) plan is in progress, there are still issues that are being discussed... our goal is to close by the end of this year, (talks) have accelerated,"" Descalzi said, when asked about the sale at a conference organised by daily Il Giornale in Milan.Reuters reported in April that the sale of minority stakes in both Enilive and bioplastic unit Novamont could fetch around 1.3 billion euros ($1.4 billion) in total and be completed by year-end. The disposal of a minority stake in the biofuel unit is part of Eni's broader strategy to create separate entities dedicated to specific businesses - called 'satellites' - and develop them with the help of deep-pocketed investors.""When we announced the strategy (in March) we were thinking (to clinch a deal) a little further ahead, but I think there is a good chance we will close (an agreement on) Enilive, with the same approach as Plenitude, by the end of this year,"" Descalzi said.Eni in March sold a minority stake in its retail and renewable unit Plenitude to Swiss asset management Energy Infrastructure Partners in a deal that has valued its unit around 10 billion euros ($10.7 billion), including debt. ($1 = 0.9328 euros)",Neutral
51,"6/24/2024, 07:31 AMUpdated 06/24/2024, 07:36 AM",BofA: Possible Alexa consumer fee indicates ongoing focus on profitability,"Reuters reported last week that Amazon (NASDAQ:AMZN) plans to introduce a two-tiered, AI-powered “Remarkable Alexa” by August, replacing its current voice assistant. The premium tier will use advanced AI for complex queries, with a subscription fee of $5 to $10 per month, separate from the $139 annual Prime membership. The paid version will offer personalized services and advanced tasks, such as writing emails and ordering from Uber Eats with a single prompt.Commenting on the news, Bank of America analysts said Alexa’s capabilities “will need to improve to stay competitive with AI advances from competitors.”Amazon has been aiming to improve Alexa's profitability for several years, with the division reportedly losing $5 billion annually in 2022. The Alexa division experienced layoffs in late 2022 and again in November 2023, when the Associated Press reported that Amazon cut ""several hundred"" employees from the unit.“While Reuters reports the division is still unprofitable, we believe an added consumer fee indicates that Amazon is committed to improving Alexa’s economics, or at least covering the cost of expanding the service offering with AI,” analysts at Bank of America said. “If Amazon does not see adoption of a paid tier, we think Amazon could cut Alexa investment further to reduce losses,” they continued.BofA estimates that there are currently around 100 million active Alexa users and if 10% subscribe to an AI-enhanced Alexa at $5 per month, it could generate an additional $600 million in revenue for AMZN.“This revenue would translate to 1.3pts of growth to our 2025 Subscription sales estimate at $49bn, and 2.6pts assuming 10% adoption of a $10/mo fee,” the bank noted.",Pos
52,"6/24/2024, 07:31 AM",Eurofins Scientific stock collapses as short seller attacks,"Investing.com – Shares of Eurofins Scientific SE (EPA:EUFI) have plummeted nearly 20% Monday, marking by far the steepest decline among the CAC 40 index stocks.The stock hit a low of 39.51 euros, a level not seen since March 2020.The reason for this plunge is a damning report from the US fund Muddy Waters, which specializes in short selling. The report claims that Eurofins has employed an excessively complex corporate structure optimized for malfeasance.The main issues highlighted in the report include related-party transactions involving real estate, complex accounting practices, including confusing cash disclosures, weak internal controls and governance, and questionable mergers and acquisitions.However, in a note published Monday in response to Eurofins Scientific's plunge, analysts at Jefferies reminded that a similarly aggressive report covering the same themes was published in 2019 by another short-selling specialist. This context suggests today's revelations might be less impactful, as the 2019 report did not result in any scandal.Nevertheless, Jefferies has maintained its ""underperform"" rating for the stock, but this is mainly due to a lack of confidence in the company's free cash flow (FCF) generation prospects, and their view of less attractive growth and margin prospects compared to larger peers.Finally, it should be noted that Jefferies has also reaffirmed its price target of 48 euros for Eurofins Scientific's stock, which is 9% lower than last Friday's close, but 12% higher than the stock price at the time of writing, given the steep decline since the Paris Stock Exchange opened.⚠️ GET 35% + 10% OFF on InvestingPro! The summer sales have started, and we are offering a 35% discount on the 1-year InvestingPro subscription, with an EXTRA 10% discount for our readers! Join InvestingPro to equip yourself with professional tools and follow our AI-driven strategies to boost your stock portfolio and know which stocks to buy regardless of market conditions! CLICK HERE to get the special reader's rate (35% off and an additional 10% off) and take your investments to the next level! ⚠️",Neg
53,"6/24/2024, 07:22 AM",These stocks are outperforming Nvidia in June,"Investing.com — Do you realize how many winners you're missing out on just by not following our AI-picked selection of winners for under $7 a month for a limited time only? Well, hate to tell you, but as the bull market rages on, that list grows bigger and bigger.In fact, while the market and mainstream media pay full attention to NVIDIA (NASDAQ:NVDA) stock, several other winners are rallying far more than the AI giant, yielding investors fat gains. Just in June, our AI picked three stocks that have, so far, significantly outperformed the AI giant. Just to name a few below:These winners, among several others, are available exclusively for our premium subscribers for less than $7 a month as part of our limited-time summer sale! Use this link to subscribe now and leverage your gains today. Differently from everything else out there, our strategies are forward-looking. No momentum trading; no bag-holding. Just best-in-breed AI-powered financial modeling.This is the exact methodology that pushed our real-world performance to a solid beat over the S&P 500 since our official launch in October. See the data below (per investment strategy):This is no backtest. This is the real-world performance unfolded right in front of our eyes.In fact, our backtest suggest that investors who follow the strategies over the long run will get even better results. See below: Source: ProPicksThis means a $100K principal in our strategy would have turned into an eye-popping $1,868,000 by now.Amazing, right?Take advantage of our exclusive summer sale and get an insight into the winners now for less than $7 a month! *And since you made it all the way to the bottom of this article, we'll give you a special 10% extra discount on all our plans with the coupon code PROPICKS20242!",Neutral
54,"6/24/2024, 06:18 AMUpdated 06/24/2024, 07:12 AM",Morning Bid: Transatlantic split reopens as half-year nears,"A look at the day ahead in U.S. and global markets from Mike DolanGlobal investors head to the half-year point this week trying to get across numerous political narratives, a hiccup in tech and a reopening of the transatlantic gap in business activity.Throw in Friday's looming release of the Federal Reserve's favoured PCE inflation gauge and an ongoing slide in Japan's yen and China's yuan and it's a sparkier summer than the buoyant first-half world markets numbers might suggest.The shakeout in artificial intelligence torchbearer Nvidia (NASDAQ:NVDA) last week, which saw its stocks recoil about 10% from new records by the end of the week, probably owes much to profit taking on its blistering rise - and perhaps also something to do with Friday's major futures and options expiries.But with the U.S. presidential TV debate this Thursday likely to sound the starting gun on speculation around November's election outcome, the final week of the first half potentially ushers in a change of tone.Politics dominates in Europe too, with the first round of France's parliamentary election this weekend and as Britainheads to the polls on July 4.So far on Monday at least, the electoral anxiety hasn't disturbed too much in markets. European stocks pushed higher, Britain's FTSE was up and U.S. stock futures were marginally positive ahead of the bell. The VIX volatility gauge has crept to its highest of the month, however.That owes something to renewed interest rate cut hopes in Europe and in the United States - where the PCE release for May should re-emphasise that disinflation has resumed.But the latest sweep of economic and business health readings for June have showed a marked divergence again in fortunes either side of the Atlantic.Flash business surveys for the euro zone and Britain showed overall activity slowing much more than forecast this month - barely remaining in expansionary territory for June.But the equivalent U.S. soundings picked up a gear and show a much faster growth clip.ECONOMIC SURPRISE INDEX TURNS NEGATIVEAdding to the confusion, and perhaps the greater comfort that more interest rate cuts are coming in the second half, is the fact that the aggregate global economic surprise index has turned negative to the worst reading in almost a year.What's more, the hesitant business move in Europe was underlined on Monday as Germany's Ifo institute showed business morale falling unexpectedly. Ifo's business climate index sank to 88.6 in June from 89.3 in May, compared with a reading of 89.7 forecast.But the real market price action was in Japan's yen, which skidded again to within a whisker of the 160 per dollar - close to 34-year low of 160.245 it set in April before the Bank of Japan intervened to prop it up.Japan's top currency diplomat Masato Kanda said on Monday authorities would take appropriate steps if there was excessive foreign exchange movement, and that the addition of Japan to the U.S. Treasury's ""monitoring list"" would not restrict their actions.Treasury last week said no major trading partner appeared to have manipulated its currency last year, but it added Japan to a foreign exchange monitoring list alongside China, Vietnam, Taiwan, Malaysia, Singapore and Germany, which were on the previous list.A summary of opinions at the BOJ's June policy meeting, meantime, showed some policymakers called for raising interest rates in a timely fashion as they saw a risk of inflation overshooting expectations.Although Japan's Nikkei lapped up the weak yen and climbed 0.5%, signs of renewed foreign capital flight and rising global trade tensions saw China's ailing markets underperform yet again.The mainland CSI300 dropped 0.5% on Monday and the offshore yuan hit its weakest level of the year.In company news, Apple (NASDAQ:AAPL)'s App Store rules breach EU tech rules because they prevent app developers from steering consumers to alternative offers, EU antitrust regulators said on Monday, a charge that could result in a hefty fine for the iPhone maker.Other big movers included Eurofins Scientific, which dropped as much as 19% after short seller Muddy Waters (NYSE:WAT) said it took a short position out on the French testing company.Britain's Prudential added 6.3% after the insurance group launched a $2 billion share buyback programme.Key developments that should provide more direction to U.S. markets later on Monday:* Dallas Fed June manufacturing survey * Federal Reserve Board Governor Christopher Waller speaks in Rome, San Francisco President Federal Reserve President Mary Daly speaks; Bank of Canada governor Tiff Macklem speaks* US Treasury auctions 3-, 6-month bills* US corporate earnings: Beyond Air (NASDAQ:XAIR), MoneyHero (By Mike Dolan, editing by Alex Richardson mike.dolan@thomsonreuters.com)",Neutral
55,"6/24/2024, 06:22 AMUpdated 06/24/2024, 07:12 AM",Australian wine sector a worrying case study for EU industries in China trade spat,"By Peter Hobson and Emma RumneyCANBERRA/LONDON (Reuters) - Hit with Chinese tariffs, Australia's wine industry struggled to offset the impact of falling exports despite scrambling to build new markets, source grapes from elsewhere and seek government help, industry executives said.That indicates what may be to come for food- and drink-producing sectors caught up in an EU-China trade dispute that threatens to complicate their access to the critical Chinese market.Though the EU's winemakers are not part of the current spat, its pork and brandy sectors fear they could be hit with retaliatory measures from Beijing after the bloc imposed tariffs of up to 38% on Chinese-made electric vehicles.Australian sectors faced similar curbs after the country's calls for an inquiry into the origins of COVID-19 led to Chinese import restrictions on a range of its products. The first tariffs on wine were introduced in November 2020. While most industries were able to find alternative - albeit often less profitable - markets, the Australian wine industry lost market share, key relationships and profits after China imposed tariffs of up to 218%. Famous for its cheap reds and pricier bottles from regions like the Clare and Barossa valleys, Australia was the world's fifth-largest wine exporter and China its most valuable export market. The move all but wiped out exports worth $800 million a year.While some larger players with production outside Australia, such as Treasury Wine Estates (OTC:TSRYF), fared better, Australia's wine exports in 2023 were worth 34% less than in 2019, according to Australian trade data. A key lesson for wine makers like William Dong, CEO of DMG Fine Wine, is not to rely too much on China again. ""Never make the same mistake,"" he said. ""We want to dance with China, but we don't want to go all in with them.""DMG, whose brands include Handpicked and House of Arras, tripled production from outside Australia to sell in China and increased its market share in the U.S. and southeast Asia following the tariffs, Dong said. It recouped some lost business, but its sales remained 30% lower than before 2020, he said. ""We were not as profitable as we used to be."" NO SUCCESS STORYTariffs, which were lifted this year, came at a time when the Australian wine industry faced global oversupply, falling consumption and COVID-19. While they were in place, Australian wine production shrank, stockpiles ballooned to more than two billion litres, and grape growers began destroying millions of unprofitable vines. Other industries such as barley, blocked by China in 2020, fared better at finding new markets but often had to settle for lower sale prices. Three executives and two people at industry associations said Australian wine makers resisted price cuts because they damage value long-term. Treasury Wine Estates was able to sell wines from outside Australia in China and began sourcing grapes from Chinese growers to get around tariffs. Penfolds, one of its brands popular in China, had higher net revenues in 2023 than before the tariffs. CEO Tim Ford (NYSE:F) told investors last week that the company was entering the post-tariff era as a ""stronger and more diversified global business"".Not all the strategies open to Australian winemakers can be easily adopted by EU industries under threat of tariffs. China's EU brandy imports, for example, are dominated by French cognac, which cannot be produced anywhere but the Cognac region in France.Such industries can diversify their sales. But building new markets takes time, Australian winemakers say. The industry turned to the government for help with expansion, with Canberra paying for wine marketers to help companies establish trade relationships in other nations.Bigger shipments to South Korea and Thailand helped lift the value of Australian wine exports to Asian countries outside China to $470 million in 2023 from $300 million in 2021, Australian trade data show.But overall, wine makers had mixed success in building sales, said Lee McLean, CEO of industry body Australian Grape & Wine. ""Our story is not a particularly successful one,"" he said.Companies like Taylors Wines, a family-owned winery in the Clare Valley in South Australia that used to sell a third of its exports in China under its Wakefield brand, have been forced to scale back their operations.Managing director Mitchell Taylor said wresting back lost market share will not be easy. French, Chilean and domestic wine makers expanded in China while companies like his lost trading relationships and laid off staff in the country, Taylor continued. ""If we ever get back to the level we had, it will take a long time.""",Neg
56,"6/24/2024, 07:01 AMUpdated 06/24/2024, 07:04 AM","RBC's analysis suggests S&P 500's fair value is 5,500","RBC Capital Markets has carried out a new valuation stress test that suggests the S&P 500's fair value would be around 5,500 by the end of the year. According to the investment bank, the analysis is grounded in optimistic assumptions about inflation, lower 10-year yields, and more Federal Reserve rate cuts than current consensus expectations. “That 5,500 index level is close to recent highs,” analysts at RBC noted. “While we consider our valuation model to be a compass, not a GPS, our work here nevertheless continues to make us worry that the US equity market has gotten a little ahead of itself in the short term due to a little too much optimism around interest rates and inflation after the latest CPI print/Fed meeting,” they added.Analysts at RBC pointed out that their 5,500 estimate is not their base case projection for the 2024 year-end, but rather an exercise aimed at understanding what the stock market may be pricing in currently. The note also mentions several more stress tests to gauge other economic scenarios. One scenario, which is more pessimistic, uses assumptions from the June Summary of Economic Projections (SEP) including a PCE rate of 2.6%, one rate cut, and a 10-year yield of 4.25%. This points to a fair value of 5,237 for the S&P 500.Another stress test considers no further Fed moves, stickier inflation and 10-year yields stabilizing around 4.5%, implying a fair value of 5,105. The most pessimistic scenario, which includes further rate hikes, higher-than-expected inflation (PCE above 3%), and a 10-year yield reaching 5.5%, indicates a fair value drop to between 4,600 and 4,700.",Neutral
57,"6/24/2024, 06:40 AMUpdated 06/24/2024, 07:04 AM","Nvidia stock down, set to shed $65 billion in market cap","Nvidia (NASDAQ:NVDA) shares are trading lower in Monday’s premarket, set to extend losses for a third straight session after already erasing more than $220 billion in market capitalization.The stock was down 2.1% in the premarket at the time of writing. At the current price, NVDA is poised to lose another $65 billion of market cap.Nvidia ended last week with a market valuation of around $3.1 trillion, lower than Apple’s (AAPL) $3.2 trillion and Microsoft’s (MSFT) $3.3 trillion. The AI chipmaker briefly overtook Microsoft last week to become the most valuable company in the world, though it couldn’t hold onto the top position for long.Still, NVDA is up 155% year-to-date, making it the best-performing stock of the tech-heavy Nasdaq 100 index.",Neg
58,"6/24/2024, 07:11 AM",Shein Confidentially Filed With UK Markets Regulator for London Listing in Early June - Reuters,"Online Fast Fashion Retailer Shein Confidentially Filed With UK Markets Regulator For London Listing In Early June, Sources Say - Reuters",Pos
59,"6/24/2024, 06:54 AM",Alumis Announces 17.65M Share IPO at $16-$18/sh,"Alumis (ALMS) has filed for 17,650,000 share IPO at $16-$18 per share.",Neutral
60,"6/24/2024, 06:37 AMUpdated 06/24/2024, 06:39 AM",UBS: Chance of 'Roaring '20s' outcome for US economy growing,"Despite a slowdown in the US economy, UBS believes the chance of a ""Roaring '20s"" outcome is actually increasing.""The roar is getting a little louder,"" the bank says, with long-term trends still aligning with their criteria for such a prosperous decade.These criteria include real GDP growth averaging 2.5% or better, inflation of 2-3%, a 10-year Treasury yield around 4%, and the Federal funds rate at 3-4%. So far, the US is on track.While recent economic strength is due to cyclical factors, unexpected immigration boosting labor supply and stronger-than-expected fiscal legislation are providing a temporary tailwind. More importantly, UBS sees signs of structurally higher growth taking root.Their analysis hinges on four supply-side megatrends: a capital spending boom, surging AI adoption, stronger business dynamism, and productivity gains. They've created a ""roar score"" to track progress on these factors.""Our conclusion is that a Roaring '20s regime is marginally more likely than it was in 4Q23,"" UBS reports. Strong household finances, increased AI investment, surging capital expenditures, and continued risk capital availability all bolster this outlook.Even though productivity growth hasn't taken off yet, disinflation progress and a potential shift to a less restrictive monetary policy by the Fed further increase the likelihood of a prosperous decade.A wildcard remains the future path of fiscal policy, with high deficits potentially requiring consolidation. However, UBS believes policy will ultimately be a headwind, not a dealbreaker.UBS believes the US economy might be slowing down, but the foundation for a ""Roaring '20s"" is being built. While not guaranteed, UBS urges investors not to underestimate this potential, drawing a parallel to the productivity boom of the late 1990s that followed an earlier period of economic slowdown.",Pos
61,"6/24/2024, 06:16 AMUpdated 06/24/2024, 06:19 AM",JPMorgan: Political uncertainty to keep weighing on Eurozone equities,"JPMorgan analysts see political uncertainty as a key hurdle for Eurozone equities, despite some positive underlying factors.""Eurozone equities showed some relative stabilization in Q1/Q2, before breaking lower most recently on a spike in French political uncertainty,"" analysts note.While the fundamentals appear stronger in the Eurozone compared to the US, with a more positive China stance and the ECB easing monetary policy, investors shouldn't jump in just yet.""Current uncertainty still needs to lift,"" JPMorgan cautions. Valuations are attractive, but Eurozone stocks haven't reached oversold territory, analysts state, adding that the key will be improved visibility on the political front, particularly the upcoming French elections.JPMorgan doesn't view the French situation as a ""game changer,"" but acknowledges near-term risks. ""The chances are that RN gets a bigger share of vote than currently assumed,"" analysts say, potentially leading to a new government testing boundaries with ""more aggressive fiscal easing."" This could force financial markets to push back, potentially causing further equity drawdowns.""We think that, as we move through 2H, there is likely to be a good entry point to buy Eurozone,"" JPMorgan concludes. However, for now, analysts recommend staying on the sidelines ""given the elevated risk of further drawdowns and no capitulation visible."" They favor defensive sectors, caution against consumer plays, and believe growth stocks will outperform value.",Neg
62,"6/24/2024, 06:10 AMUpdated 06/24/2024, 06:17 AM","Evercore: Stocks to remain expensive as S&P 500 forecast to end at 6,000","US stocks are expensive and will remain so, Evercore ISI analysts said Sunday, as they expect the S&P 500 to end the year as high as 6,000.However, as the history of previous “expensive markets” suggests, some of the sharpest gains can occur once equities become expensive, the investment firm added.“What makes each of the prior “expensive markets” unique is their own trajectory with regard to time, price, earnings and breadth,” analysts said.“Common to all, valuation alone is not sufficient to sell,” they added.Evercore attributes this year’s ""expensive"" market to several factors.These include “the promise of the AI revolution,” Federal Reserve’s willingness to cut interest rates for the ""right"" reasons, a relatively short period of market duration and gains, the prospect of a return to earnings growth in 2024, and relatively robust market breadth, even though the ""Mag 7"" stocks have been doing much of the heavy lifting.",Pos
